{
  "$schema": "../../schemas/rarn.schema.json",
  "name": "rarn-overbuilt-game",
  "version": "0.1.0",
  "private": true,
  "realm": "shared",
  "packageDir": "Packages",
  "place": {
    "sharedPackages": "game.ReplicatedStorage.Shared Packages",
    "serverPackages": "game.ServerScriptService.ServerPackages"
  },
  "dependencies": {
    "@sleitnick/knit": "^1.7.0",
    "@jsdotlua/luau-polyfill": "^1.2.7",
    "@csqrl/sift": "^0.0.11",
    "@joelbrd/table": "^1.0.19",
    "@b-j-roberts/starknet-luau": "*"
  },
  "serverDependencies": {
    "@sleitnick/comm": "^1.0.1"
  },
  "devDependencies": {
    "@roblox/testez": "^0.4.1"
  },
  "aliases": {
    "@sleitnick/knit": "Framework"
  },
  "resolutions": {
    "@csqrl/sift": "0.0.8"
  }
}
